user_id,user_id,item_id,item_id,timestamp,rating,review,sentences
A1VDKIKK9U4VKT,A1VDKIKK9U4VKT,B001IEWX2A,B001IEWX2A,1364428800,4.0,This toy has been discontinued by Fisher Price. It is one I think they should improve and bring back. The only real downfall to this toy is the open back. You drop the letters in and they fall right out the back. My baby got this toy for Christmas and she loves it. The little birdie on the top is super cute. My baby prefers the letters to the package. She can certainly sit and play with it for long periods of time. Very nice toy.,['very nice toy']
A1WHS75R55GWQL,A1WHS75R55GWQL,B004CVJQJY,B004CVJQJY,1358640000,4.0,This is a very cute toy.  Priced decently.  The only drawback is that the dolls fall out if you don't strap them in and they are a bit of a pain to get strapped down.  Otherwise this is a cute addition to the Lalaloopsy sets.,['This is a very cute toy']
A3FKPBNI7UWQFW,A3FKPBNI7UWQFW,B0041G2YN0,B0041G2YN0,1365292800,4.0,"I picked up this game when our son was still too young for it (1.5 yrs old, but loves to build stuff), but have since brought it out when we had house guests with 5-6 yr olds. The older kids enjoyed this game for about an hour, then became bored with it.",['5 yrs old']
A2YSWNMW4E78GF,A2YSWNMW4E78GF,B004GEBSK2,B004GEBSK2,1335744000,5.0,"We received this as a gift for our son.  There are not a lot of features, and it is a little hard for him to open, but both my boys play with it a lot.  The pieces are big enough that I don't have to worry about my youngest choking on them, and my oldest is three now and still plays with it.  We've had the toy for two years now and it has held up through quite a beating, and still looks new. It can be purchased a lot cheaper at other stores than for what it is listed here.  Great value for the money.  We actually bought another one to keep at grandparents home for a good toy when we visit.  We paid $12 or $13 for it.",['Great value for the money']
A3AE2LAXSIML73,A3AE2LAXSIML73,B00G4VN3EY,B00G4VN3EY,1397779200,5.0,"Wow, what a great deal.  These dresses are adorable.  Considering the price I have no complaints.  Thank you very much!",['what a great deal']
AWYV2R69Z0GSG,AWYV2R69Z0GSG,B00BZ8KN94,B00BZ8KN94,1385510400,4.0,"Cute game.  Basically, there are several compartments that you can peak into and find treasures (you have to find treasures that match the cards).  What makes it interesting, is that you can shake the box and have all the treasures shift to a completely different place, even to a different compartment.  It's basically a Look & Find that continually changes.  My 4 and 6 year old girls both enjoyed it.  We just opened the box so I can't speak to its staying power but I suspect it will be a keeper.",['cute game']
A34BGBLEA2522I,A34BGBLEA2522I,B000FKCYAO,B000FKCYAO,1358294400,5.0,This is the best stroller I've bought. I've gone through to strollers that break with in the week of buying them. This one is strong...caught my three year old pushing her two year old sister in it with no issues. Worth every penny!,['Worth every penny']
A1LZI9TLEJ3405,A1LZI9TLEJ3405,B002WB7WQ0,B002WB7WQ0,1379808000,5.0,"Thomas pieces are just right for little fingers to play with, and carry around in a pocket!  Good buy !",['Good buy']
A2TJQUPTZOD7QE,A2TJQUPTZOD7QE,B004FSE52C,B004FSE52C,1370044800,4.0,"this is a fun game, picked it up on a gold box deal of the day sale and the price was right.",['This is a fun game']
A303DPVG2ULRF3,A303DPVG2ULRF3,B000NDMDHC,B000NDMDHC,1372377600,4.0,"It works if you have friends that do not mind laying a smack down or just play out of spite, good times :)",['good times']
A1QT3N5FUQ4I47,A1QT3N5FUQ4I47,B000FIOB2A,B000FIOB2A,1295654400,5.0,"I have no complaints about this ""trike"". It seems durable and sturdy and went together well. My son's interested in it and loves to ring the bell. For all that, I give 5 stars.However, it might be helpful for some parents to hear that my son is around 30"" and is really too short to ride this. He is small for his age... measured 29.5 a couple of weeks before we gave it to him. It's been another month and I think he's grown, and still can't really reach the floor if he's on the seat. On the other hand, I don't know that there are any similar options for shorter kids, so no regrets about buying this one, just thought that might be helpful info for some parents.",['On the other hand']
A265IEMG2K5R4W,A265IEMG2K5R4W,B00ANKD7V6,B00ANKD7V6,1383523200,5.0,"My wife is a puzzler, and there's kind of a limit to how many puzzles I can get her without getting bored with it. But this little doodad really fit the bill! It has 6 durable and flexible plastic trays in the shape of puzzle pieces. They are stackable, so you can use them in minimal space. The box calls them ""interlocking"" or some such thing, but that's not to be confused with the reality that they don't actually ""lock"" together; they just lay nicely, shape to shape. This does help somewhat with stability on the table top, as you have to move all to move one, rather than having them just shift at any touch. And I know enough about puzzles to know that shifting leads to groaning and words. Anyway, they're stored in a really nice (not cheapo) puzzle-type box, so they can store in your puzzle closet. I'm assuming you have a puzzle closet, because you're reading this review. She's happy, I'm happy. Definitely a win-win. Good product.","['Good product', ""I'm happy""]"
A3LC0ZUZGZTGBV,A3LC0ZUZGZTGBV,B004S6BXNA,B004S6BXNA,1380240000,4.0,"This toy is very durable.  I babysit and one of the boys is VERY rough on toys and he plays with this often, throwing it down banging it etc..it still works perfectly.  The only thing I hate about this toy is the volume.  It has a low and loud but the loud is Super loud and the low is loud.  Usually toys noises don't bother me but this one can be a bit obnoxious.",['This toy is very durable']
A3LMPD1ZQTWOC4,A3LMPD1ZQTWOC4,B0083SSLRU,B0083SSLRU,1363132800,5.0,"I just finished doing this bag with my daughter.  She has just started coming into the world of American Girl and was very excited when I showed her this box and eager to get started.  Upon opening the box, I was surprised to see such a nice canvas cinch sack.  It seems very sturdy and well made.  4 sheets of iron-ons are included, though two sheets are taken up with the alphabet.  My daughter loved the fact she was going to be able to put her name on the bag.  My daughter is almost six, a little younger than the recommended age of 8.  So I cut apart all of the transfers and let her arrange the pictures and letters on the bag how she wanted so I could iron them.  I would recommend ironing the bag before beginning this process as it would have made it a little easier to lay the pictures out and not have to move them to iron the folding crease out.  Next time, I would also lay everything out on the ironing board and let her design it there because it was hard to move the bag from the counter to the ironing board in the next room without moving her design around.  The transfers ironed on pretty easily.  The instructions recommend using an ironing cloth over the plastic.  I just used a thin wash cloth and it worked great.  As we were peeling the plastic off the transfers, a few looked as though they might not stick to the bag.  But we just laid the plastic back down and re-ironed those spots.  The plastic peeled off the bag perfectly leaving every piece of artwork in tact.  It is a very cute and sporty looking bag.  We will leave it laying flat to bond for the next 24 hours, as recommended, and then she will be ready to use it.  Overall, a well made craft and cute results.  Now I'm going to need another for my other daughter.",['next time']
A3NEAETOSXDBOM,A3NEAETOSXDBOM,B007HZ9PZ2,B007HZ9PZ2,1346198400,4.0,"My 20 month old granddaughter likes to see the puppy's nose light up when she touches it, to ""feed"" the puppy with the included blocks, and to listen to the music.Although this is a cute toy, keep some things in mind.1. As other reviews have noted, it is not easy to sit on this puppy while on carpet and try to ride it. My granddaughter no longer bothers trying.2. The cover that pops up to convert this to a push toy is not something a child can easily do; I have trouble myself sometimes. Other reviews have noted this. Also this is rather cumbersome to push. My granddaughter prefers to use her little stroller instead, which is much lighter and more easily maneuverable whether on carpet or tile.3. For a riding toy, Fisher Price's Dino the Dinosaur is easier to use.Bottom line: This toy is fun for my granddaughter despite its shortcomings.",['As other reviews have noted']
A2KLFJ0GHM3NFO,A2KLFJ0GHM3NFO,B00A92K0KY,B00A92K0KY,1366156800,5.0,"Beast Hunters Shockwave is one of the best!Shockwave returns in transformers prime more badass than ever.This is the coolest version of the Decepticon scientiest since the G1 days.Shockwave has a perfect blend of the beastly attitude combined with the signature G1 style.The head sculpt on this bad boy is amazingly done to perfection with quality articulation throughout the rest of the transformer overall.The detail in both robot and cybertronian tank mode is awesome as well with perfect prime series accuracy.The Cybertronian Tank mode is one of the coolest and improved vehicle modes for Shockwave since the G1 days as well.Shockwave comes with his signature Hyperflux Cannon for the series which has realistic spinning action that is very simple to activate by pushing the button on the arm.Shockwave uses the left tank tredd to connect to the arm for the complete signature look.Shockwave does come with some cool as hell snap-on beast armor that gives him a more menacing beastly appearence.The beast armor is optional to have on or off,so its all in what you think looks better.The poseability is outstanding with great stability for creating cool battle scenes or displaying this gem where you please.The durability is excellent as well with secure ball joint construction and a solid build in either robot or cybertronian tank mode.All parts fit securely together during the transformation process for one solid constructed transformer overall.The transformation level is intermediate meaning if you have plenty of experience with transformers there is mid-level difficulty.If you are a parent buying for a child of 5-6 you might need to help some in the transformationj process.Honestly Shockwave does have a versatile transformation that 5 and above can learn easily after a little practice.To start off disconnect the tank tredd from the arm.Next you rotate the legs around sideways as the legs then will rotate straight up.Rotate the shins and feet down then rotate inwards.The feet rotate down as the next step involves you sliding the feet forward.Rotate the chest piece down so it's between the legs as the head piece will rotate around.The back piece with the tank tredds rotate out as the two purple sections on the chest area slide outwards.The arm with a hand will rotate down and then in forming a L-shape.The arm will then connect underneath as the weapon arm will do the same above.The weapon piece will connect to the middle part on top.Reconnect the tank tredd and Shockwave is ready to roll into battle!In vehicle mode the Hyperflux Cannon is stationary with no side to side movement,but this is not a big deal for how awesome the overall transformer is.If you are a fan of Shockwave this is one Voyager class version that is a masterpiece of quality that will be a treasure in your world of transformers.Bottom line Transformers Prime Beast Hunters Shockwave is a well-made,high quality,10 out of 10 transformer all fans will enjoy.I highly recommend Transformers Prime Beast Hunters Shockwave to all transformer fans and collectors out there.Shockwave Rocks and Transformers Rule!!!","['high quality', 'The transformation level is intermediate meaning if you have plenty of experience with transformers there is mid-level difficulty', 'The poseability is outstanding with great stability for creating cool battle scenes or displaying this gem where you please']"
AU13W2MG55NNC,AU13W2MG55NNC,B00106CGP0,B00106CGP0,1392681600,2.0,"This is a neat toy, the animals are average Little People quality, meaning the paint on them is a little scuffed and raw on the edges and things. The animals they chose for the aA - Z are nice, not the average ones you may think of. As for the mat the animals can &#34;step&#34; on and the sounds they make, I was not impressed. Most dont sound like what the animal should and it scares my daughter. I wish you could turn the volume up or down, its just one loud sound. The extra snow mountain and safari cave are just put aside and kind of boring. The tree is fun but does not attach from the mat making it poor.Really this is so overpriced it isnt even funny and completely not worth it, I wanted my daughter to have a set of animals like the little people people she has and this was literally the only thing I could find so I bought it. She loves the animals and plays with them everyday, however the rest is sitting in a closet untouched and unfun.",['This is a neat toy']
A215WH6RUDUCMP,A215WH6RUDUCMP,B00CTUGP6W,B00CTUGP6W,1383091200,5.0,"This Advent Calendar really takes the cake! Not only does it take interactive to a whole to level (most simply involve opening the day and earning a piece of candy), this treats your Child to a different surprise each day featuring Angry Birds and adding pieces to their building project! It's super exciting as they continue to count down to Christmas, build up and remake K'nex every day, this definitely holds their attention way more! The best part? No more candy!",['The best part']
A2QQ2GS40R57BU,A2QQ2GS40R57BU,B003LPUCM2,B003LPUCM2,1357689600,5.0,Not only does this hold and protect the MobiGo (which is really all I bought it for) it also has an extra pocket for game storage. It is very easy for my son (who is 3) to open and close and put his games in and out. Great product!,['Great product']
A35MDIBPAX9X7U,A35MDIBPAX9X7U,B004DJ51WQ,B004DJ51WQ,1345161600,5.0,"One of the best educational toys we have purchased. This is a fantastic product that serves as a great introduction to specific skills: sorting, counting, and basic math. It is also a fantastic way to help kiddos develop greater attention, concentration, and focus. Helps with fine motor skills as well.As other reviewers have noted, the toy is well-made, durable, and can be used in imaginative play as well.There is a reason why math teachers LOVE these types of sorting toys. They really are great.",['As other reviewers have noted']
A138A1KMMGH9J4,A138A1KMMGH9J4,B0077NCEWA,B0077NCEWA,1388361600,5.0,"My son really like it, I bought a few of the toys for the Jake's Land. (Boat of Jake and Hook + Figurine Set + Magical Tiki Hideout Playset ). He really love all of them. The material is good.",['The material is good']
A151IA6N46ZMQA,A151IA6N46ZMQA,B00C0ULS3G,B00C0ULS3G,1405036800,5.0,"Great old school drinking game. Hit, drink, hit drink. Sink, pound! Good fun",['Good fun']
A3R6RMXSWHTZHG,A3R6RMXSWHTZHG,B001RNJ8WK,B001RNJ8WK,1325635200,2.0,"This is a cheap product...I don't expect it to last long considering that it's for kids who tend to give it more force than necessary.  After 2 plays, at least 1 of the hippos gets stuck.  Also, it's RIDICULOUS that the game put together does not fit in the box it came in!!!!  They expect your kids to take it apart each time they are done with it and put it back together when they want to use it again.  Really...it's in the directions!  I threw the box away and now have to find a suitable place for the game because there's no way my 4 and 2 year old are gonna do that.  The Hungry Hippos game isn't what it was when I was a kid, that's for sure.","[""that's for sure""]"
A2507ZYWGMY9BK,A2507ZYWGMY9BK,B007HZ9PZ2,B007HZ9PZ2,1346630400,5.0,"(See update for long term impressions)This toy doesn't move well on either carpet or hard surfaces. The wheels are small, cheap, and don't rotate well. They also don't have any tread so the toy just slides instead of rolling.The other major problem is the locking mechanism for the seat that allows it to switch positions. The mechanism requires large hands so a small toddler can't do it. The build quality of the mechanism is very poor because it doesn't securely lock the seat - there is a tremendous amount of ""play"" in each position and it just doesn't feel durable.On the positive side, the plastic shapes have been fun for my 2.5 year old to play with and stick into the puppy's belly or into its mouth. She can reach in on the other side of the belly to pull the shapes out.The music is fun and pleasant (not annoying to parents) and the sound quality is actually very impressive with good intelligibility. There are 3 buttons in addition to the nose button which all light up and are easy to press.Overall, I would say this puppy is fun to interact with but the construction quality is poor. The distinguishing feature of this toy is the ability to ride or push it. Unfortunately, this feature doesn't work well. So what you are left with is a pretty bulky stationary toy. If you have plenty of room in your house, this may not be a big deal. But for most people, a more compact interactive toy would be preferable.UPDATE: I am upgrading this toy to 4 stars because despite the lousy wheels, my 10-month-old who is on the verge of walking has been having fun pushing it around the house. It works better than I thought it would as a ""walker"" and my baby uses it much more than I expected. The music is also motion activated so the dog ""sings"" and shakes its head while being pushed. There have been no issues with durability to date.UPDATE May 2014: After 1.5 years of this toy, my kids (2 and 4 years old) still enjoy playing with it and pushing it all over the place. This is somewhat amazing since they usually get bored of a toy (or break it) in no time. Despite my concerns about the build quality, nothing has broken on this toy and it is in near perfect condition. This toy has stood the test of time and deserves 5 stars (my initial rating was 3 stars).",['On the positive side']
A2QDOJFFLFGF18,A2QDOJFFLFGF18,B000W9OYKQ,B000W9OYKQ,1282694400,5.0,"This was a nice little gift for a birthday and it was a big hit. I like there are no little pieces and the furniture id big, so they dont lie around the floor. You cannot have to many dolls live in the house, but it is fun and we even brought extra rooms to add. Overall a great product.",['Overall a great product']
A382CZ7Z8DWI4O,A382CZ7Z8DWI4O,B00F14IM5K,B00F14IM5K,1399334400,5.0,Great doll.just love the blue hair very hip hair style.my daughter loves him and thinks he is a must have for anyone that is a real monster high collector or monster high fan. very different from the other boys,['Great doll']
ANP5ZZGG9U7KZ,ANP5ZZGG9U7KZ,B000NR4BLY,B000NR4BLY,1280793600,5.0,"Each of the 166 puzzles presents a number of circles, where the solver must place a number of colored chips.  The puzzle comes with one or more clues as to the relationships between the chips (""One of the red chips is directly on the left of an orange chip"", ""A blue chip is somewhere below a white chip"" and so forth).  That's it-- but the puzzles are quite well thought out, varied, engaging, and arranged in difficulty levels sufficient to challenge most children.  As a tool for building deductive and critical thinking skills, it is worth its weight in gold.I am not sure whether there is overlap with the Logic Links books; there are 100 or so puzzles in each book, and 166 total puzzles by comparison here.  Perhaps the boxed set is a ""best of"" from the other books, something to be aware of.  In any event the puzzles would take most children quite some time to work through, so I think this is at least a very good choice for a first pick in the series (you would then be guaranteed to encounter at least some new puzzles in the books).The price works out to pennies a puzzle.  You can't beat this value.  For younger children, I would also check out ""Clever Castle"".",['For younger children']
A3DYEUD88GBYIX,A3DYEUD88GBYIX,B0015YT88A,B0015YT88A,1317513600,5.0,"This kitchen took me two evenings to assemble - with the ""help"" of our 3 year old daughter.  I had to undo and redo 2 sections because I didn't follow the instructions exactly the first time.  If you can, assemble this when someone else is not climbing all over it and taking all the parts out of the labelled container.  When it was all put together - it's fantastic.  Door problems were mentioned by many reviewers.  I don't really know how the doors can fall off if they are assembled according to the instructions - though I can see how they could if you do not use ALL of the screws and bolts.  There are no extra pieces if the instructions are followed.  The kitchen is gorgeous.  The ""dishwasher"" gets used as a cabinet for dishes - since the door opens sideways.  We complemented the kitchen with pots and pans, stoneware dishes, the plastic ""glass"" set and utensils - all from Ikea (great quality and price - only available at the stores, not on-line).  Also, and as it turns out, essential - a smallish handled brush for hand washing dishes.  We also started with the Mellissa and Doug ""food groups"" and have been given some other packaged foods and plastic food items.  This is a great kitchen.  We searched for the tallest one - since on her 3rd birthday last month our daughter was 39.5 inches tall.  She has to stretch and get on her tip-toes to reach the back of the shelf & microwave.  Constant use for a month has resulted in no dings to the finish (my assembling did, however - though could certainly have been avoided).  I would strongly recommend this kitchen to anyone with a tall (or older) child.  Also, the free delivery brought the kitchen to our door in 2 days.",['5 inches tall']
A3171W06FF8EE6,A3171W06FF8EE6,B006O6FJ0A,B006O6FJ0A,1391212800,5.0,"This is so darling!  As soon as I saw it, I knew my daughter would love it.  She loves things that come in special cases, plus this is on wheels!  The handle does come off too easily, but its easy to put back on.  Its easy for her to play with.  She loves to stand Minnie on the stage, watch her twirl and say cute things.  This has been a great toy.  We have been able to fit some other Minnie mouse accessories we previously had purchased in this same case.  Great buy!  Would defiantly recommend this.",['Great buy']
ANCOMAI0I7LVG,ANCOMAI0I7LVG,B00138RVKK,B00138RVKK,1255305600,5.0,"I'm breaking out of my comfort zone here (I usually ONLY review books, movies and music) to review a toy I recently purchased for my daughter (this is the fifth of 5 reviews).  My daughter (who is 2) is IN LOVE with Dora and Diego.  She already has a few Dora dolls (not to mention a bedspread) but I just couldn't resist these little Ty dolls.I actually really like the size.  She can stuff all five of her dolls in her Dora Backpack and take them around the house with her.  She loves to take Swiper to bed with her (I don't advise young ones sleeping with Dora or Diego, beings that their hair is a bit of a choking hazard).  IN FACT, Swiper is the reason I bought these dolls.  For some reason (don't ask me) Swiper is her favorite character on the show.  She is constantly talking about him, getting all excited when he shows up on the cartoon, and when I told her that I ordered her one she kept telling me ""Swiper neeky box (sneaky fox) coming my house!""  When he finally showed up you would have sworn it was raining candy.  She hasn't let him out of her sight since.My one iffy complaint about Swiper is the tail.  It's just so big and heavy and constantly falls over...but she doesn't care so I'm happy.  Someone else complained that the tail came loose, which is what I fear may happen soon, but I won't balk until it does (and even then, I'm sure it's an easy fix).Yes, I gave it only four stars on durability since the ware and tear of a toddler can do some damage.  Boots already is separating at the seams on his legs, so I had to get onto my little one for pulling at his legs.  No, his legs are not falling off, but I can tell that they are getting weak.  So, just watch your little ones to make sure they don't `love these little guys to death'.If your kids love Dora (and especially that neeky box Swiper) you can rest easy knowing that they will LOVE these dolls as well!And a note to parents, these toys are NOT educational; but the show is VERY much so (my kids speaks Spanish!  Like, OMG, I don't speak a word and she converses with me in Spanish at TWO YEARS OLD!!!).","['She can stuff all five of her dolls in her Dora Backpack and take them around the house with her', ""just watch your little ones to make sure they don't `love these little guys to death'"", 'these toys are NOT educational; but the show is VERY much so (my kids speaks Spanish']"
