user_id,user_id,item_id,item_id,timestamp,rating,review,sentences
AYLAZUCGWB6IE,AYLAZUCGWB6IE,B001QGUFDO,B001QGUFDO,1261699200,5.0,"Radio Flyers are a classic and a must have for all kids - so we were STOKED to get one for Christmas last year. It's great to use to store toys or cart him around the neighborhood. It's large, very roomy, looks sharp and very classy. Only problem, it's bulky. I've always wanted a wagon that I could pop into my car and take with us to a park or an outdoors Farmer's Market. The wagon would fit, but then I couldn't fit much of anything else. I saw someone with the On The Edge Wagon, asked them what they thought, did some research and had it on my wish list for ages. I finally got one.Pros:It's small. Folds up very flat and compact. No assembly required. Comes FULLY stocked with a storage bin (in the back) - 2 cup holders (in the front) and the canopy. Unlike the Radio Flyer which you have to buy additional accessories. EXCEPTIONALLY ROOMY!! My 1 year old, 2 Bostons (26lb & 27lb) can fit in it without climbing on each other. Steers with ease. IF we took my son out in it, we could lay some blankets on the bottom (it is very firm and I can see it getting to be uncomfortable after maybe 45 minutes sitting in it). The storage bin is large - I can definitely fit my diaper bag and a bunch of other things in it. There is also a ""hook"" that keeps the handle upright so you don't have to ""drop"" it on the ground when you're out. Nice - keeps the handle clean. The system comes with a cover that wraps around it for storage (and keeps it clean).Cons:Kinda smells - it's the packaging so I'm waiting to air it out.Some parts look cheap - like the plastic caps and poles that holds the canopy up. We shall see if it will make it through grabby kiddos. The Canopy sits about 3inches lower than I'd like. not a lot of head room (if your kid's torso is really tall - it may be annoying since they may not be able to see out).Surprises:I didn't expect the bars all to be wrapped in protective covering - the picture on Amazon, has the cross bars exposed. I'm glad it's covered - especially since my kid likes to gnaw on things.Wish List:Wish there were ""jump seat"" features where my kid could be strapped in.More padding on the bottom - or at least an extra insert.For the price point and all the accessories that it comes with, you can't beat it. Very convienent, doesn't take up much space and stylish (for a wagon).","[""It's small"", ""It's large""]"
ASH0DZQQF6AIZ,ASH0DZQQF6AIZ,B0025WYXIG,B0025WYXIG,1325462400,3.0,"I like the looks of this kite and really hoped it would be easy to fly.  I have children who are 3 and 6, and we like to go to the National Kite Festival.  Based on other reviews, it looks like this kite has a minimum and maximum wind speed window in which it likes to fly.  Unfortunately, we were not in that window; winds were too light.  We did get it to fly about 15 to 20 feet high and 30 yards or so away from us.  My 3 year-old was flying it, so people thought it was cute and did not mind walking into the line.  One time, we did get it up high enough to where it caught some good winds and gained altitude... that was nice, but it took some effort to keep it aloft even at altitude.The construction of the kite seems sturdy and the materials feel durable.  It packs up small and is very light.  Just know what type of winds you'll be flying in.  I think it is a good kite overall.  Hopefully we'll get it to the beach some time and try it out there.",['Based on other reviews']
AKJHHD5VEH7VG,AKJHHD5VEH7VG,B0017XEMW6,B0017XEMW6,1261353600,5.0,"I bought this for my son's third birthday. I also purchased the additional two sets of cars that go with it.  Five of us (adults included) played with this for over an hour without and we were all playing at the same time. Six cars, five arms and a ton of laughter. It was so much fun.The assembly process was a bit of a pain. This isn't a toy that can be moved around very easily as the ramps would need to be hooked up again. I do suggest finding a place where it's okay to leave the toy up.  It's not a painful assembly process but it would be annoying if I had to put it all together on a daily basis.User friendly issues:  The only issue is the ramp assembly. Twice my kids have knocked off a ramp and the two smaller kids can't put it back together themselves.  It's an easy thing to correct. Overall there is enough room for little arms to move around to position cars. They've knocked the ramp off when they are rowdy with the toy.Charging the cars on the ramp: I thought it was fun that the cars only go so far and then stop for charging.  There are two charging stations and three pumps and the cars are off again. I don't see this as a con to the playset but a plus.The cars: These are the kind that you pull backwards to charge. The cars can be used without the ramps. I've also seen my 3-year-old move the cars on the ramp with his hands.  They don't HAVE to be ""charged"" to play with.  They are fun and colorful and big enough for little hands.  Again, I see no cons with this.  This set comes with two cars and there are two additional sets of 2 cars that are available for purchase.Sound effects: I have to be honest, they don't bother me but they drive my husband crazy. They aren't necessary to play. If it's a problem, the batteries can be removed.Overall I think this is an excellent toy. Comparison shop for the prices. I found this at a chain toy store on clearance[...]. If I would have known what I wanted to buy as the birthday gift though, I would have just ordered it on here for ease of convenience. My kids (even the 13-year-old) played with this set for hours the night of my son's birthday. The next morning, it was the first thing my son wanted to play with when he got up.  A few days later and it's still the most popular toy in the house.",['It was SO much fun']
A8HUL9LPJWF4L,A8HUL9LPJWF4L,B001543YEY,B001543YEY,1364947200,5.0,"This is a great tea set and very durable.My twins, boy and girl, play with these often and they use water in the tea kettle and cups.No leaking.we love this product!!!And since it's green ...... I feel comfortable about them drinking out of it or eating off the plates.Well done!!!Great toy!!Will last forever.",['Great toy']
A16IQIEFLGEQCB,A16IQIEFLGEQCB,B0017VRTCI,B0017VRTCI,1377820800,5.0,Grandson loves it.  Bright and cheery colors.  3 year old playing with items and holding up very well. Great Item!,['great item']
ABTKLCZQ5I1QX,ABTKLCZQ5I1QX,B006WAIIM4,B006WAIIM4,1342483200,5.0,"This doll is so great.  I love everything about her.  She has great hair, plus the mask is cute.  I was impressed that they gave her art work on her left arm, which that was a first.  Plus if you choose to take her mask off they gave her a scar, which is why she is in need of a mask.  I just bought my 2nd one she is so good.  As far as educational value goes, this doll seems to pack a lot of punch.  Not only is she educational as to who her father is, but where her name is Operetta I think it's inspirational and teaches girls that they can do anything they want to, and girls are just as good as boys are.  I was really impressed by this doll.  Recommended beyond words!",['As far as educational value goes']
ADYR709YFUVPF,ADYR709YFUVPF,B000FK3WDC,B000FK3WDC,1388534400,5.0,5 year old loves this. Driving his parents nuts. Great fun. Perfect for young and old. He is helping the ninja turtles fight crime.,['Great fun']
A3SXKYRPNCIJL5,A3SXKYRPNCIJL5,B001OXRTX8,B001OXRTX8,1357084800,5.0,"My grand-daughter loves doing crafts learning new things so this was perfect for her,so many colors to choose from it gets their minds going. Good buy!!",['Good buy']
AFXYJ65KSX8QH,AFXYJ65KSX8QH,B0016BRD16,B0016BRD16,1235865600,5.0,very cute doll. my 4 year old just loves it. batteries seem to last a while. it has been 3 months and still have the same set in. fun and worth the money,['Very cute doll']
A3H22U1E3JV2NM,A3H22U1E3JV2NM,B000TTPEXU,B000TTPEXU,1227398400,5.0,"My son just got this for his birthday. I wanted him to have a game that was not only fun, but that he could learn from. My son has autism and my goal for this game was to work on his listening skills and turn taking.  It's funny how he doesn't listen when I tell him something but when this game talks, he listens. He had a ball running around to all the targets. My son hasn't spent that much time playing a single game in his life!I had a ball playing it too.  This game is so much fun!",['This game is so much fun']
A20GBVCS8IW72S,A20GBVCS8IW72S,B006CD0G0I,B006CD0G0I,1372636800,5.0,"Its the original my little pony. Good quality. Its like the little sisters of the normal ponies, that's what I was told by my daughter.",['Good quality']
AWMUKP0HKLU2X,AWMUKP0HKLU2X,B0014GTZ0U,B0014GTZ0U,1260144000,5.0,Great stocking stuffer. Durable 'lion man' can fight with all the other guys..even King Kong! Great imaginary thing.,['great stocking stuffer']
A2NS3IPJV3SRAK,A2NS3IPJV3SRAK,B0017RQYDC,B0017RQYDC,1220832000,5.0,"I remembered how much fun CLUE was when I was younger and decided to purchase it for my younger siblings (we often have game nights at my apartment with ages 8-40+). This game is recommended for ages 9+ and 3-6 players (although you could do more if you wanted to do teams).If you are a die-hard CLUE fan you may not like the updates. The most annoying updates (I found) was changing the careers of the characters. I still refer to mustard as ""Col. Mustard"" and ""Mrs. White"" as the maid (who is now a childhood star?"" Personally, it's a bored game and the characters can be whoever you want them to be so it's not that big of deal (this is where the die-hards may not like it.)Game Play:The idea is the same as the original clue. The name of one person, one weapon and one room is put into the yellow confidential pouch and put aside until the end of the game. The rest of the ""rumor"" cards (which list people, weapons, and rooms) are equally handed out to the players. (As a note if we have an unequal amount we have a roll off to see who gets the remaining card (or two) by seeing who can roll doubles first... this is a fair and easy way to get all the cards distributed.)Once you receive your cards you mark off all the cards you have in your hand on the CLUE sheets secretly. You choose which character you want to be. (Choices: Scarlet, Mustard, White, Green, Peacock, and Plum). The character you choose gets a special character card and once per game you can use their ""power"" (example ""get an extra roll of the dice"" or ""move to a room you're not in""...) this is okay, but I personally don't think it adds too much to the game.Some of the weapons have changed and the mansion has been updated. The weapons now are ""bat, pistol, candlestick, knife, robe, axe, dumbbell, poison, and trophy."" While some people hate that the wrench was replaced with a trophy, my (high school aged) sister loves it and has been hoping every game that it would be the murder weapon. (Not yet :))You roll the dice and move the number of spaces until you get into a room. In the room you can start a rumor blaming a person, weapon, and the room you are in. (For example I think Mrs. Scarlet did it, in the Hall, with the Knife.)Everyone else must look at their cards and if they have one of the ones you said show it to you alone. You secretly mark it down on the Clue sheet. The catch is they only show you one. They may have all three or two of them.The addition to the game that we really enjoyed are the intrigue cards. If you roll a ""?"" mark, land on a ""?"" mark, or, if you were moved during your turned (being blamed for a murder) you can choose to pull one. Most of them are positive saying things such as ""the player to your right must show you a card"" or ""you can take another turn, roll again"", 8 of the cards are not. There are 8 clock cards mixed in the pile. The idea is that the murder has not happened yet and you are trying to figure out the case before the host of the party dies (this is different from the first game as the host has a chance of living.)This adds a lot of fun. Once 7 clock cards have been pulled, no one wants to be the person who pulls the 8th clock card and kills the host so it gets interesting! The game rules say if you pull the 8th clock card you are out of the game. We made a house rule and don't follow this (no one likes to sit and watch everyone else play.)When the person thinks they've figured out the mystery they have to move their piece to the pool. This can be interesting itself because someone can move you to a room (during their turn if they blame your character for the murder) and you can have a difficult time getting to the pool. Once in there the person says (for example, ""I think Mr. Plum, in the Spa, with the Poison"")... They then look at the cards in the confidential folder privately. If right they win the game, if wrong they put the cards back in the folder and are ""out"" for the rest of the game.Pros:*The ""Suspicion"" cards with the 8 clock cards add a lot of fun and a little bit of pressure to figure it out more quickly. We really enjoy this aspect of the game.*The updates, for the most part, are pretty cute although most of them don't affect the game play*Same basic premise of the original game*This game seems to never get old and is accepted pretty well by everyoneCons:*Really these are personal quirks but I liked the original names of the characters... We still call him Col. Mustard lol*My sister doesn't like the new game pieces... Instead of pieces that look like the characters, they are plastic question marks in the color of their names (example: Mustard=Yellow). Not terrible, but I guess could be better*Murder is both taken lightly and discussed throughout the game, but that should be a given as it is a CLUE murder game. Some might find this to be a problem, though.We love this game and really enjoy the 8 clock countdown aspect of the play. Def. recommend.",['for the most part']
A1S1BJFTA644TU,A1S1BJFTA644TU,B00146G706,B00146G706,1382400000,4.0,"So the worst thing about this toy needs to be addressed right away: the puzzle pieces are a thick cardboard.  Not flimsy, but not Melissa and Doug quality wood.  That sucks.  Because if you have a rough little one who likes to bend things in half or gnaw on things, you might lose a few pieces.  Still, they are too durable for a 17th month old or a two year old to break.  But as soon as your toddler starts getting strong, he/she might break a couple pieces.  There are no choking hazards in the box, unless your toddler gnaws off a hand.  Which will not be EASY, but it is doable.The box which holds the pieces is wood.  The puzzle board top to the box is wood, but the side with the outlines is a sheet of that strong cardboard.  This is stupid.  It should be one wooden piece.Otherwise, the puzzle is a joy for toddlers new to puzzles.  The variety of pieces fascinates them and keeps them busy for quite a while.  They are chunky and easy to handle.  The art is colorful and cute.  The varying faces help teach emotions.  The various clothing combinations teach sorting and fashion ( I suppose).So, for the price, it's a good buy.","[""it's a good buy""]"
A1NA2I8KSZCDUQ,A1NA2I8KSZCDUQ,B000NW5RWQ,B000NW5RWQ,1200009600,5.0,"This is the 3rd version of the ocean wonders aquarium we've bought over the years, and this is the best one yet.  From the visuals to the (especially) the excellent volume control and remote control, our new 3 month old already  loves this.  Would highly recommend for encouraging any baby's attiontion and comfort in their crib.  (We also liked the birdie one from '04, if they are even still selling that one).  Great buy!",['Great buy']
A3FNZ1APZYGMNA,A3FNZ1APZYGMNA,B006CD0ADQ,B006CD0ADQ,1361232000,5.0,"Ok so first a little background on this guy.after the death of the original Captain America Steve Rogers. Tony stark Fafiling a promise made to Rogers. Brings Bucky Barns in as the new CAPTAIN AMERICA!THINGS I LIKE ABOUT THE FIGURE!1. PAINT JOB!The matalic red white and blue on blackIs my favorite color scheme for Captain America.2.UTILITY BELT!this figure is complete with a utility belt.Gun Holster, knife sheath, pockets.3.ACCESSORIES!Gun, knife shield.4.FACE SCULPT!The face sculpt on this guy is actually betterthan the diamond selects version.THINGS I DON'T LIKE ABOUT THE FIGURE!1.THE SHIELD THAT CAME WITH HIM!Problem is easily solved by switching it with another shield.I absolutely love this figure and recommend it to fans of Captain America, and people who just want a great figure!THANKS FOR READING!IF THIS REVIEW WAS HELPFUL TO YOU PLEASE LEAVE A COMMENT!",['IF THIS REVIEW WAS HELPFUL TO YOU PLEASE LEAVE A COMMENT']
A1WDDZTSP0F3KE,A1WDDZTSP0F3KE,B009VR1IV8,B009VR1IV8,1357948800,5.0,"This set came in a Lego brand plastic bag with the picture of the train on it. Instructions were easy to follow. Train Attaches together securely. Quality pieces you expect from Lego. Just have to keep it out of reach of younger siblings because pieces do fall off but are put back together easily. Overall I give this set a 5 star rating for duribily, quality time for assembly, and for the fact that it is an actual rolling train, not just a non-working display piece.",['Instructions were easy to follow']
A2Z60PVKWFO3SW,A2Z60PVKWFO3SW,B000LRLA1U,B000LRLA1U,1193529600,5.0,"This is a great learning toy;  the books are more simplistic and less busy than the regular LeapPad books, and it would be a perfectly good toy for kids aged 18 mos - 3 or maybe even 4.However, I recommend you at least consider the LeapPad because it will have a longer lifespan.  In our home, the LeapPad is still being used by our 3rd grader.  And my youngest son hardly ever played with his ""My First LeapPad"" when he was a toddler, preferring his siblings' LeapPad.Another reason to look at the regular LeapPad is that the regular books also start at pre-K, and contain far more activities and games than the ""My First LeapPad"" books.On the other hand, the ""My First LeapPad"" books are sturdier, more like board books, whereas the regular books are a just a thick, high quality paper.And if you are not concerned with longevity or don't wish to invest the extra $ for the regular LeapPad, your young child is bound to enjoy this pared down version.One other thought, one of my kids tended to absently chew the cord on the pen if he wasn't supervised.  I wrapped them with tape and the pens continued to work, but if you have a child who tends to put things in their mouth or who is teething, you will want to supervise the use of this toy.",['On the other hand']
A5BXA4BQOK0S2,A5BXA4BQOK0S2,B003FHXMDC,B003FHXMDC,1372118400,5.0,"It's plastic, but well built. The batteries are easy to install if you know how to read/follow the instructions. The spring is very powerful which makes it feel even better when you pop out the claws. The sounds are nice and loud and you can't even see the speaker. Great fun!",['Great fun']
A7BQB93ZWUII3,A7BQB93ZWUII3,B009Z7E8I4,B009Z7E8I4,1386460800,5.0,"Great toy, sturdy. Lived up to the Play-Doh name. I like the new doh that comes with, ended up buying another pack of the doh.",['Great toy']
A1VLVWTLV3LVHR,A1VLVWTLV3LVHR,B00B1D7ANK,B00B1D7ANK,1378166400,5.0,"There are tons of toys literally littering my kids toy box. Little pieces, I should say. Let's be honest, toys are just, for the most part, not very durable. When I was a kid, toys lasted forever, easily taking the beating I would dish out over long hot summer days, not to mention the rush of new toys on Christmas morning.The Schleich Dragon Rider Toy reminds me of those toys, in so far as how durable it is. The little rider guy is removable, and the wings are both easily removed and put back with no problem. And none of that weakening after repeated on/off operations.My son loves this toy. He has played with it almost non-stop since I gave it to him. The packaging was easy to open. The toy itself is heavy, at least the dragon is. It feels solid, well built. While pricy for a toy of this nature, the level of detail and craftsmanship justifies the price.Schleich Dragon Rider Toy is a good toy, one that will last a very long time!",['for the most part']
A1163KPPHHDAHU,A1163KPPHHDAHU,B008AWFWA8,B008AWFWA8,1393027200,5.0,"My son is completely head over heels for his Bubble Puppy.  He doesn't go to sleep without it.  The world stops spinning when it is lost and we have to find it immediately.  I am going to buy a couple backups for the day it either breaks or really gets lost.  Buy this and I guarantee that you will be the best mom or dad ever.  That is if your child watches Bubble Guppies.  Let's face it, they do.","[""Let's face it""]"
A3R144P0AZSY90,A3R144P0AZSY90,B0042TBGC6,B0042TBGC6,1385337600,5.0,"Very pretty shoes.  Gold thread mesh on pink is very fancy and looks nice on dolls, fit well.  Very happy with purchase.",['Very Happy with purchase']
A2MBLVMVDLHK1L,A2MBLVMVDLHK1L,B004U5FTBG,B004U5FTBG,1318982400,5.0,"This is a great toy to give to kids when you're running errands or standing around talking to grownups and being boring, because it travels easily and can recharge while you're in the car. It's extremely speedy, and even though I rammed it into lots of stuff while learning to control it smoothly, it's still running along happily.The charge seems to last for about a half hour of play, and everyone who has played with it has had fun (except for one napping cat who was offended at being woken by it). It is definitely best on very smooth surfaces, like hallways, or flooring. It worked on one type of sidewalk, but not another (marginally less smooth) type of sidewalk.My only criticism of this very fun toy is that I wish the tires had been designed better. They are plastic, not rubber, so the car spins out easily. And the tires are so small that you can't possibly run the car on many outdoor surfaces, even rather normal-seeming sidewalks, as the height of the car is such that it gets stuck on the aggregate and won't go. A taller, rubberized tire would make a world of difference in how usable this toy is.That said, it's loads of fun, very durable and speedy, and I've had a blast playing with it. Definitely a hit in my household!","[""it's loads of fun""]"
A32T2H8150OJLU,A32T2H8150OJLU,B002ZCXNQE,B002ZCXNQE,1356048000,5.0,"This is the biggest puzzle I have ever attempted - and it's a good one, well.  My two daughters (ages 13 and 22) were my main co-workers, and it's taken us a while, but we did it!  I'd say that all in all we probably averaged between 30-60 mins a day (combined time) working on this puzzle.We opened the box and poured out the pieces on 6 October.  By the end of that day we had found and assembled all but 2 or 3 edge pieces.  Then the REAL work began.  The short version is that we finished it tonight, 21 Dec - Whew! I'm sure glad the world didn't end before we could wrap this up!Here's how we did it.  Edges first - no mystery there for practiced puzzle assemblers.  Next we did the birds.  Their bright colors made them easy to work on.  As we did this we also pieced together the hippos, though it took quite a while before they were all the way done.  Next was the outline of the rhino - the first time through you will have a hard time telling the difference between rhino and elephant pieces, but overall, the rhino has more of a yellow hue, while the elephants are more gray. While this was going on we also stared to piece together the trees in the upper right-hand corner.  Then we tackled the giraffes and gazelles.The hardest part?  I'd say it was a toss-up between the big zebras and the elephants.  But probably because they were smaller, we finished the zebras before the elephants, and finding the odd piece here and there.My older daughter came up with the quote of the day as we prepared to take on the elephants in earnest.  She said,""There comes a time in every puzzle when you have to buckle down and do the elephants"".You just have to buckle down and do it.As for the puzzle itself...I found it to be well made.  The pieces fit together nicely.  There was a nice assortment of pieces, and it was a challenge to complete.At first we thought that we were one piece short, but we found it!  It was 8 months later, but still, we found it!So that's my experience with this puzzle.  Oh, one more thing...you need to make sure that you have a LOT of space for the puzzle and the pieces.  It took an entire ping pong table to accommodate the pieces when we did it.All in all, a very nice puzzle.",['One more thing']
AP8D74QD9LUUL,AP8D74QD9LUUL,B00CP4J7OY,B00CP4J7OY,1395446400,5.0,"This tablet is perfect for a child who is interested in having his/her own tablet, but is not ready for the responsibility of caring for an expensive grown-up tablet.The apps/games it comes with are minimal, but my 3-year old grandson greatly enjoys the built-in camera and pet care app that comes pre-installed. There are not a huge number of items (there are apps, storybooks and videos) that can be downloaded from the Leapfrog site, but there are enough to keep a young child entertained.  Those that are available are educational, reasonably priced for the most part, and feature characters that your child will already be familiar with like Team Umizoomi and Doc McStuffins.  If I had one nitpick it would be that you can't get Angry Birds for this tablet, which is the 3-year-old's favorite game.This tablet has been treated rather roughly, and dropped more than once, but seems no worse for wear.By the time your child is 5-6 they will probably outgrow this, but if your 3-year-old is jealous of your or his/her older sibling's tablet, this is a good option.",['this is a good option']
