user_id,user_id,item_id,item_id,timestamp,rating,review,sentences
A1XJOSJN6FHFO0,A1XJOSJN6FHFO0,B00B28GVLG,B00B28GVLG,1381968000,5.0,"I remember this game from years ago when we would all sit around as a family and play it...GREAT FUN!  My daughter still has the original box and all the pieces including the game cards that we used.  This game is exactly like the original one. It was such a joy to see it all bright and new looking. Of course I had my family sit down and we played game after game, and loved every minute of it. Old memories mixed with new ones, it was great.  Listen, sometimes you just have to walk away from all the new tech that is constantly being thrown at us, take a deep breath, and relive some joys of yesteryear. If you loved playing Yahtzee and you would like to keep the fun  going from generation to generation, this is for you. Feels just like going home again. Enjoy! Well worth your time.",['Great fun']
A2ZO5SU0ESSB1N,A2ZO5SU0ESSB1N,B00BRCN9TO,B00BRCN9TO,1370304000,5.0,"My daughter loves her tag reader and the books. She is an early reader and the books are perfect as they let her read when she can, and be read to when she needs to. She loved to grab her books and 'pen' and go off into a chair by herself and read. Any parent would be happy to see that! Like other reviewers, my only complaint is the lack of available memory on the reader itself- it appears that 10 books is about all it can handle. Within days of getting the reader we had almost that many added to it! I can see we will have to 'delete' older books to add new ones- something that is sure NOT to make the kid happy.But the ease of use is what sells the reader. My daughter loves the Disney tie ins with the books, as she loves the movies. You have to have seen the previous Monster movie to understand who the characters are in this book, which she did so we were fine there. I was NOT impressed with the durability of the 3d glasses (they tore by the 3rd use) and the fact that only 2 pages seem to really be able to use them, making them seem like an expensive add on.The book has my daughter ready to see the movie, and I'm happy she's reading, so it's a win-win for us!",['Like other reviewers']
A1FXY0GUFHEI59,A1FXY0GUFHEI59,B00CJHZRW8,B00CJHZRW8,1372464000,5.0,"My previous favorite toy wasMagna-Tiles Clear Colors 100 Piece Set.  I bought them when my oldest grandson was 3.  He just turned 6.  They have entertained him, and his cousins for hours and hours in the short time we have had them.  I love seeing how creative in their constructions they can be.The Magformers Wow Set was a Lightning Deal and I thought it might be a good addition since it had some wheels and can make cars/trucks/trains. etc.  After I ordered it, I decided 16 pieces would not be enough, so I also ordered a 62 piece set.  They both arrived today while the 6 year old was here.  We had the best time with them.  They can do things the Magnatiles cannot do.  I am most impressed with the instructions on how to lay the pieces out flat and then lift by one of the center pieces, pulling it into a 3-D figure.  You can't do that with the Magnatiles since they are solid and have no opening in the center to pick them up.  I am a retired geometry teacher, so to be able to have children translate what they want their 3-D figure to look like when finished into the 2-D model is HUGE.  I don't expect my 6 year old grandson to be able to do this for awhile, but he can make the pattern the picture shows and see how it will pull into the 3-D figure.  I want toys he can grow with and this is definitely one of those.  I have 7 grandchildren, so I expect these will be a favorite toy to play with at grandma's house.  I ordered another set this afternoon because I saw that there are sets with pentagons and we didn't have any in the sets I already purchased.  Yes, these are an investment, but I expect they will be a favorite for many, many years.  Possibly even longer than Legos, since we really haven't gotten into those yet.",['many years']
A35MDIBPAX9X7U,A35MDIBPAX9X7U,B00270WHQG,B00270WHQG,1333670400,5.0,"Kiddos love to water plants-- its all about copying the grown-up, playing with water, and being independent. We've tried a few different watering cans, but they are usually way to heavy for little ones and not sized for kiddo hands.This Melissa & Doug Watering Can is a HIT! It is bright and colorful, sized PERFECTLY for young children, and holds enough water to be fun without getting too heavy. Its super durable, made of very strong plastic, and high quality.Can't recommend this enough-- perfect for spring and summer in the garden with children.",['and high quality']
A19FRW264WZTGP,A19FRW264WZTGP,B00DI2CNKC,B00DI2CNKC,1388880000,4.0,"This is an excellent adjustable height tee.  I am a little biased because I'm short on space and I like my SKLZ collapse/travel one.  But if you have growing kids and space is not a problem, this is a great choice.I have many SKLZ products.  They are not always the best, but they are decent and worth the money.  I recommend this.",['this is a great choice']
A1VYFEJM12ZP11,A1VYFEJM12ZP11,B007J3FAJ2,B007J3FAJ2,1349308800,4.0,"Construction was time consuming.  There were 30+ steps to follow and many parts, but aside from the time it took I'd say that it was pretty easy when following the directions.  Without directions, I'd say it would be very frustrating.A word of caution, this thing is HUGE.  DO NOT ASSEMBLE in a room with a small door.  We almost were not able to move this out of the room that we assembled it in.  We had to really maneuver it and squeeze it to fit it through what I thought was an average sized door (door to our home office).This thing is for children up to 3.  I think that is a fair assessment.  I felt like they could have added a few more features and this thing would have been cool for kids much older than three - but probably that was cost prohibitive.Many of the activities on this play set felt a little like afterthoughts thrown in - like the inflatable ball that just hangs from a pipe, and the green gate thing, and there is a plastic spinner part on one of the pipes.  I was also let down by the cannon thing on top.  It doesn't really shoot balls.  You put the ball in and it kind of falls out onto the trampoline.  In fairness - this toy isn't meant to impress an adult or an older kid it is meant to be fun for a little kid so that will probably suffice.The scale of this toy is so impressive though, especially to a toddler.  They are drawn to it like a magnet.  It is hours of fun.  And since there is a volume control for the music that plays parents shouldn't be too annoyed.",['This thing is huge']
A337T56JH8J5YZ,A337T56JH8J5YZ,B008G3JZIG,B008G3JZIG,1360022400,5.0,"This toy is durable and fun. It also helps my daughter work on her fine moter skills. Great price, great product.","['Great product', 'great price']"
A1JE7ZFZ71MR13,A1JE7ZFZ71MR13,B000ETRENI,B000ETRENI,1288569600,5.0,"This toy is great.  When they are crawling or even just rolling you can take two of the legs off so they can play with it.  It keeps my son entertained for at least a half hour.  When he gets bored with it he rolls over and kicks the keyboard and that entertains him for another few minutes.  This toy is durable, fun and great for all ages.  My niece loves it too and she is 18 months old.  I would purchase this again in a heartbeat!",['this toy is great']
A1JHXOJ6203FDL,A1JHXOJ6203FDL,B002Q7IE9O,B002Q7IE9O,1293580800,5.0,Purchased as a Christmas gift for our 4-year old.  Great toy!  I love the open-ended play and seemingly endless possibilities of this track.  We purchased add-on packs as well but the core set is a great starting place.  He has constructed and re-constructed track after track and is very interested in this toy.  The pieces are well constructed and easy to use.,['Great toy']
A3C9YGB4H90PDE,A3C9YGB4H90PDE,B004UC4RVM,B004UC4RVM,1316044800,3.0,"I loved the idea of this version of Simon, but unfortunately it didn't work as well as one would hope. We read the instructions and lined up the cubes and pressed them as directed. Most of the time the cubes did not respond as they should have. It took far more fiddling to get it to the correct mode than we though it should. Mostly we found it frustrating. Another concern is that each cube takes 2 AAA batteries, for a total of 8. That would get expensive with much playing.On the positive side, it's cool how there are 4 different modes, or games, you can choose from to keep it interesting. I also liked the storage case, and that it can be used for Simon Classic.",['On the positive side']
AGNNY2OUDZ6YW,AGNNY2OUDZ6YW,B000HAVGMY,B000HAVGMY,1388275200,5.0,"This is a very cute toy. I bought it for my 2 1/2 year old grandson, and he loved it. The toy is well made and sturdy compared to other fishing toys I've seen.",['This is a very cute toy']
A1NOBRCN20NGD5,A1NOBRCN20NGD5,B004KZ597A,B004KZ597A,1358380800,4.0,"This is a great little game from Ravensburger that my oldest boy, 2 and a half years old, already loves. We don't play it as a game yet, but it works as a puzzle just as well. He is able to sort out the pieces and his color/shape recognition is improving after a few tries. I can already tell that he learning and using this game to learn the shapes and colors faster is a great toolThe only drawback that I see is that there aren't extra pieces in the game and no extra pieces sold. It will be easy to lose one of these pieces, and then you're stuck with a game/puzzle that you can't use as well.Your kids will enjoy it, from ages 2 and up. Great idea, great little game. Recommended.","['Great idea', 'Great little game']"
A3N3WE6U6N794O,A3N3WE6U6N794O,B0095ZMTE6,B0095ZMTE6,1389312000,5.0,"The set is awesome, but I'm not going to get into the details as others have.  Just beware...the set is available at most major box stores as well as at the manufacturer's (as of 1/10/14) at much lower prices.  So do your research online and be sure to get a fair price (which right now is less than $200 for sure!).  Five minutes of web searching could save you a lot of money.Once this set retires, it will be a different story so if you're on the fence...get moving!GOOD LUCK!","['Good luck', 'the set is awesome']"
A1YTXJE0ZS0IK7,A1YTXJE0ZS0IK7,B0060FN7B8,B0060FN7B8,1379289600,5.0,"to let the kids get creative with their tracks. We bought our train table and track second hand, so we have a mish mash of different sets and no plans to actually know how things are supposed to go together. These let us easily use all of our pieces and make all kinds of configurations. Great buy.",['Great buy']
A3HP7JU4ZORF52,A3HP7JU4ZORF52,B00164CKIO,B00164CKIO,1295740800,4.0,"I collect robots and I was overjoyed with my hubby bought me this. Robot toys are usually very expensive but this is affordable, and for the price it is rather advanced, it is also extremely cute. Let us just say that with my little, yellow robot started a great love for Hexbug toys.Now this robot walks around, and when it hit something it changes direction due to sensors build into the toy, however it is the second feature of the robot which I like the most. If you clap your hands over the robot or produce any loud clapping sound it will change directions, in fact by clapping at the right times you can control where the robot go by sound and make it walk in the direction you desire, it might be that I am just childish, but I found that to be extremely entertaining.This little robot is fun, it is colorful and it have two very interesting functions. I think any kid would love one. However remember that this is a robot, it is somewhat fragile and therefore is not suitable to the youngest kids. This toy is also great for adults who like electronic toys or robots. This is a simple toy, it is somewhat limited as to what it do, but for what it is I think it is great value for your money and I highly recommend it.",['This is a simple toy']
A9EVBE6MJ4YX4,A9EVBE6MJ4YX4,B002Q7IE9O,B002Q7IE9O,1292284800,5.0,"My 6 yr old son got htis for his birthday a few weeks ago and loves it. Some starter sets come with so little you really can't have any fun with them.  Not so with this set. Set comes with 1 car, a good amount of track, one loop, one curve, and one ""jump"" ramp.  Also has the clamp to start the car up high off of any table, etc, and the thing that shoots the car going (whatever they call it). Lots of ways to set this all up.  AND, yes, educational!! How so, you ask?  Well our son realized that he couldn't get the car to go all thru the loop the curve and have enough speed to make the jump at the end.  Ah Ha! So he started re-arranging the set he'd designed. Speed = mass or something like that -- there's a math equation in there, I'm sure.  Pieces all feel like I remember -- pretty durable.  Case is perfect to hold all the stuff and it shows the diffrent add on sets you can get to make an even bigger race track! For the price, and A+ on playing, you just can't go wrong with this set.  Thumbs up all the way!","[""I'm sure""]"
A11AW1AVGA058V,A11AW1AVGA058V,B004K1EZ38,B004K1EZ38,1357689600,5.0,"MY four year old daughter has had a great time doing the crafts included in this box. Great value, and lots of entertainment!",['Great value']
A2RFVSWZOBFDJ,A2RFVSWZOBFDJ,B0039KIW9E,B0039KIW9E,1342051200,5.0,"Ok, before I start, let me clue you in on the fact that you can order this toy from Mattel's collector website at ""MattyCollector"" and you will pay $33 (or less if its on sale like it is the day I type this, for $29.70) plus shipping.This toy is fun!  Very detailed and the He-Man figures can right it with ease!  If you take the mask off you can see a very well detailed tiger face and you can open and close the mouth.  It should be a hit with the kids that just like big cats!  :)It is a must for He-Man fans!",['This toy is fun']
A2LER8S3UAHQDZ,A2LER8S3UAHQDZ,B003V5XV3Y,B003V5XV3Y,1307836800,4.0,"This is such a cool toy for such a low price. It was, as expected, my son's favorite birthday present we gave him. The only complaint I have is that it is too big for him right now. He is 3 years old. His arm isn't long enough to fit through the hand strap. He can use it by holding onto the blue light to pull it up so it makes the shooting and flying noises and lights up. He loves the cloth glove as well, and uses it as his Spiderman glove as well as his Iron Man glove. He also liked how the button on the side makes it say, ""I am Iron Man"". We took away the torpedoes until he is older and won't shoot his sister or lose them.January 2012: My son doesn't play with this toy much any more. I think it's not comfortable enough for him. There should be a smaller version of this toy made for 2-4 year olds. He dresses up like Iron Man often, but never wants to put this one even when I ask him if he wants it.",['He is 3 years old']
A3E7E854VCA4E7,A3E7E854VCA4E7,B007X8ZZRU,B007X8ZZRU,1353801600,3.0,"After the AppBlaster and the AppFishing, here comes the AppDrive.  Last year, when we reviewed the AppBlaster, my husband was quite impressed with the possibilities of the blaster and the games.  Since then we have discovered new products from AppToys which are distributed through SpinMaster.  I tried the AppDrive, while everyone else were busy with other things in the house on Sunday afternoon.  I must admit that I always was challenged with driving games and I think I will always be challenged with them.  Somehow, it looks as though I prefer the off the road trips...  Nevertheless, I have a good understanding on how the game works and how the AppDrive will help the player to enjoy his ride.Essentially, the AppDrive is a device that looks like a wheel and your challenge is to drive whatever vehicle the game you have selected will offer.  You can insert an iPhone, iPod or an android device inside the wheel to play the game.  Check the box to make sure that your device is supported with it.Once you start the game,you are in for a ride!  The game I tried was 2XL MX Offroad which is a game with a four-wheeler that you need to control.  As I mentioned before, I am not gifted with this type of games on the iPod.  However, I enjoyed the graphics and the fact that I could control the four-wheeler myself.  You also have the possibility of choosing the vehicle and the driver.  You can go backward or forward as well as control the direction of the vehicle.  If you hit a tree your drive will be ejected and thrown in the air.  Sometimes,my drive also got squished under the vehicle itself.  But there was no blood whatsoever in the game which is great if you ask me.  I would have no hesitation whatsoever to let my kids play with it.Even though I am more challenge than my kids would be for this sort of game, I have enjoyed driving my four-wheeler and explore the surroundings.  Did I made any jump?  No as I quickly got lost in the woods...  Did I hit some trees?  You bet.  But I am willing to persevere and become better - though I suspect that I am better an puzzle games and quest types of games...Asphalt 7 and 2XL MX Offroad are free apps that can be downloaded anytime via iTunes.  Other apps that will work with the AppDrive are 2XL Supercross HD, Ricky Carmichael's Motocross Matchup Pro, and the 2XL Trophylite Rally HD.The AppDrive will provide tons of fun for anyone who love driving games.  The fact that it simulates a wheel makes it even more interesting.  It would be a great birthday or Christmas gift for someone who likes this sort of games and owns a device that is supported.",['Last year']
A13BX9O5UDBILC,A13BX9O5UDBILC,B007R1Z80W,B007R1Z80W,1373760000,5.0,"This is a great summer toy. Works as advertised and even my 6 year old can do it now. Wish the balloons themselves are a bit better quality, but not a big deal. I would even say that there is some education value as I used the water balloons to teach my kids how to catch a ball properly and even used it for batting practice while cooling off.The product is well made and works as advertised.",['but not a big deal']
AQSW6WDVCJGB8,AQSW6WDVCJGB8,B006ROJI10,B006ROJI10,1339545600,5.0,"What a clever piece of innovative puzzle amusement!  I had reservations about what the Underwater World would entail but was very surprised by the sheer coolness of the product.  First, the pieces are sturdy!  Fairly thick and fits snugly in place with the adjoining pieces witout tatters or splits. That's just plain ol' great craftsmanship!  In this day and age of craptastic, volume selling assembly lines, it's fantastic to know that a company like Ravenburger just... well, gives a durn.  They care and it shows in the alignment of the puzzle pieces, the fact that the pieces wrap flawlessly around a ball(!) and the weight and feel of the construction.  It doesn't feel cheap.The pieces aren't that small but the age recommendation is spot on.  Over 4 to 5 years old due to choking hazard.Highly recommended!",['The pieces are sturdy']
A1GMIHHABWEDPX,A1GMIHHABWEDPX,B005LAZDMY,B005LAZDMY,1398297600,5.0,"I am very pleased with my purchase of the Royalbaby Kids 14&#34; bike. I got the 14&#34; for my average-height 4 year old daughter for her to grow into and use for years. She loved it! The red is beautiful, really well made, great quality. The training wheels are a little rickety, not so sturdy but I actually like that since it makes my daughter pay attention to her balance and prepares her to take them off soon.",['Great quality']
A3POAVTU2XS9B1,A3POAVTU2XS9B1,B000P13PH4,B000P13PH4,1305936000,5.0,"This is a fast-moving, free-for-all of a game.  Everyone plays at once, as fast as they can.  You play your cards as quickly as possible.  New piles start in the center of the table every time somebody plays a one card.  We had to make a house rule that you can only play with one hand at a time, because my kids were laying down cards with both hands.  There's lots of laughing, and some cursing when someone else lays down the card that someone else was just about to lay down.The more people you have, the more fun it is.  Not much of a two-player game, but you can have up to twelve.  The practical limit is 6 to 8 players so that everyone can reach the center of the table.It's alot of fun, and there's no waiting for your turn since everyone plays at once.  It's never boring.I recommend this game, especially for teens and families with teens.",['the more fun it is']
A28G3C33E5GW3P,A28G3C33E5GW3P,B007HHQ4VI,B007HHQ4VI,1347148800,5.0,We love this swing!  It is study and comfortable for our toddler grandchildren!  GREAT product!The swing was delivered quickly too!  We had a bucket type baby swing but it was getting uncomfortable to fit the legs into the holes but this swing is EXCELLENT and I'm probably going to purchase a second one soon because of the kids all wanting to swing on this one!,['Great product']
A1WSPI9D3OV22M,A1WSPI9D3OV22M,B00764ROYI,B00764ROYI,1384732800,5.0,"Love, love, LOVE the dive sticks!!  They stand up on the bottom of the pool so younger kids don't have to go as far down, and they look really cool sitting there!  Made of a nice pliable rubber. Bright colors. The perfect party favor for my daughter's 6th bday pool party.",['Bright colors']
A2EO36JTKXRCF4,A2EO36JTKXRCF4,B008CP6KG8,B008CP6KG8,1369785600,4.0,"Scribblenauts Unlimited is great. This one actually has a story. It explains how Maxwell got his magic notebook and goes on to say Maxwell was using his magic notebook for evil and when he used it on someone, that person cursed his sister into turning into stone, and now he must go get starites to save her. The game's core is still the same, and like every entry, they added a bajillion more words and adjectives for you to mess around with. The puzzles have gotten WAY easier, as if the game wasn't easy enough. The puzzles seem to be a bit more simple and the hints are more obvious. The graphics are still the same, and that's fine with me. One of the new features was to create new items, which basically, instead of letting players use their imagination, it just serves as an option for everyone to make dirty, obscene things and create everything in the world that is copyrighted, in other words, breaking the rule set by Scribblenauts that said no bad words or copyrighted material. However, this feature doesn't seem to be in the 3DS version, or I just can't find it. And trust me, I tried. There really isn't much to say about this game, it's still a fun sandbox game where you can choose whether to make a a creative and/or clever solution, or just go with the obvious, normal way, so you can't blame the game because of the solutions, because there will always be a different way to do a puzzle. I give this game a 3.8/5.0",['In other words']
A16AXQ11SZA8SQ,A16AXQ11SZA8SQ,B00AJCNP24,B00AJCNP24,1362009600,5.0,"I ordered this for my 2-year old grandson.  It took his mom about 15 minutes to put it together, and she liked that the tracks are on both sides of the track pieces.  In other words, if it doesn't fit together one way, just flip the piece over and it should fit.  The pieces fit together solidly, and they connect with magnets, not latches (which makes it easier to put the pieces together).  The only caveat about putting the track together is that it would be easier if the child were NOT in the room.  My grandson was so excited to play with his new Thomas Train that he kept trying to ""help"" put the pieces together.Once the track was together, it kept the grandson busy for hours!  He got all his other wheeled toys out, so that they could make friends with Thomas.  I think it might have even been more fun to watch him play than it was for him to play with this train set (but only because it was so fun listening to him squeal with excitement every time he tried something new with the train set).This set is a winner, and because it's so sturdy, it's worth every penny of the price.",['In other words']
